{
  "id": "marvel-rivals",
  "steamAppId": 2767030,
  "displayName": "Marvel Rivals",
  "role": "generalize",
  "pinned": true,
  "engine": "Unreal Engine 5",
  "graphicsApi": "d3d12",
  "antiCheat": "other",
  "macNative": false,
  "backend": {
    "preferred": "vkd3d-moltenvk",
    "fallback": "dxvk-moltenvk"
  },
  "executables": ["Marvel-Win64-Shipping.exe", "MarvelRivals.exe"],
  "launch": {
    "args": ["-dx12"],
    "env": {
      "SteamDeck": "0"
    }
  },
  "controllerRequired": false,
  "settings": {
    "notes": "Second Play target. NetEase anti-cheat (ACE) will likely block online. DX12 path for the stack."
  },
  "benchmark": {
    "route": "Boot to title if anti-cheat allows",
    "durationSeconds": 60
  },
  "knownIssues": [
    "Kernel/user anti-cheat (ACE). Online play is expected to fail. Boot is the experiment.",
    "D3D12 via vkd3d-proton + MoltenVK."
  ],
  "research": {
    "steam": "https://store.steampowered.com/app/2767030/",
    "protondb": "https://www.protondb.com/app/2767030/"
  }
}
