{
  "id": "aperture-desk-job",
  "steamAppId": 1902490,
  "displayName": "Aperture Desk Job",
  "role": "smoke",
  "pinned": true,
  "engine": "Source 2",
  "graphicsApi": "vulkan",
  "antiCheat": "none",
  "macNative": false,
  "backend": {
    "preferred": "dxvk-moltenvk",
    "fallback": "moltenvk"
  },
  "executables": ["Aperture Desk Job.exe", "deskjob.exe"],
  "launch": {
    "args": [
      "-game", "steampal", "-novr",
      "-windowed", "-width", "1600", "-height", "900"
    ],
    "workingDirectory": "game",
    "window": {
      "mode": "windowed",
      "width": 1600,
      "height": 900
    },
    "env": {
      "SteamDeck": "0",
      "SteamAppId": "1902490",
      "SteamGameId": "1902490"
    }
  },
  "controllerRequired": true,
  "settings": {
    "upscaler": "native",
    "rayTracing": "off",
    "safeBoot": true,
    "diskBudgetGB": 5,
    "steamClient": true,
    "notes": "First safe boot. Free, ~3 GB, no anti-cheat. Proves Play. Does not prove D3D12 / Spider-Man."
  },
  "benchmark": {
    "route": "Intro through first gameplay segment",
    "durationSeconds": 60
  },
  "knownIssues": [
    "Wants a wired controller. Steam Input needs a signed-in Steam and the pad plugged in before Play.",
    "Vulkan/Source 2 — not the D3D12 path.",
    "Windows build tries DX11 first. Without DXVK, Wine reports feature level 9.5 and it dies."
  ],
  "research": {
    "steam": "https://store.steampowered.com/app/1902490/",
    "protondb": "https://www.protondb.com/app/1902490/",
    "why": "Light plumbing smoke. Safe to Install on this Mac."
  }
}
